lemmaName(en),lemmaName(pt),idPOS,senseDescription(pt),idLU,source_file
tough,resistente,84,"FN: forte e durável",17186,lus_imported_from_english_with_lemma_chunk173_2025-11-14_211449.csv
strength,Força,83,"FN: a qualidade ou estado de ser forte, e/ou a capacidade de resistir a grande força",17187,lus_imported_from_english_with_lemma_chunk173_2025-11-14_211449.csv
weak,fraco,84,"FN: não (resistir à grande força)",17189,lus_imported_from_english_with_lemma_chunk173_2025-11-14_211449.csv
durable,durável,84,"FN: a capacidade de resistir ao desgaste, à deterioração, etc.; durável",17196,lus_imported_from_english_with_lemma_chunk174_2025-11-14_211734.csv
flexible,flexível,84,"FN: capaz de ser dobrado (geralmente sem quebrar)",17206,lus_imported_from_english_with_lemma_chunk174_2025-11-14_211734.csv
supple,flexível,84,"Wiki: dobrável, flexível, fácil de dobrar",31030,lus_imported_from_english_with_lemma_chunk174_2025-11-14_211734.csv
solid,sólido,84,"Resistente, capaz de suportar grandes quantidades de dano.",34128,lus_imported_from_english_with_lemma_chunk174_2025-11-14_211734.csv
faction,facção,83,"FN: um subgrupo que compartilha opiniões ou objetivos diferentes dos do grupo maior, especialmente, tal grupo dentro de um partido político.",18560,lus_imported_from_english_with_lemma_chunk174_2025-11-14_211734.csv
sect,seita,83,"FN: um subgrupo dentro de uma religião baseado em crenças diferentes da maioria, geralmente levando a uma organização separada.
<ex>O Cristianismo começou como uma seita judaica.</ex>",18562,lus_imported_from_english_with_lemma_chunk174_2025-11-14_211734.csv
prevent,prevenir,86,"COD: manter de acontecer ou surgir.",13529,lus_imported_from_english_with_lemma_chunk174_2025-11-14_211734.csv
"stave off",afastar,86,"FN: prevenir algo ruim ou perigoso.",13534,lus_imported_from_english_with_lemma_chunk174_2025-11-14_211734.csv
check,interromper,86,"FN: interromper o progresso de algo.",13535,lus_imported_from_english_with_lemma_chunk174_2025-11-14_211734.csv
prohibit,proibir,86,"COD: prevenir.",13539,lus_imported_from_english_with_lemma_chunk174_2025-11-14_211734.csv
stop,parar,86,"FN: prevenir um evento de ocorrer.",13540,lus_imported_from_english_with_lemma_chunk174_2025-11-14_211734.csv
keep,manter,86,"FN: prevenir (com foco no estado anterior).",13542,lus_imported_from_english_with_lemma_chunk174_2025-11-14_211734.csv
prevent,prevenir,86,"COD: manter de acontecer ou surgir.",30736,lus_imported_from_english_with_lemma_chunk174_2025-11-14_211734.csv
"stave off",prevenir,86,"FN: prevenir algo ruim ou perigoso.",30741,lus_imported_from_english_with_lemma_chunk174_2025-11-14_211734.csv
check,interromper,86,"FN: interromper o progresso de algo.",30742,lus_imported_from_english_with_lemma_chunk174_2025-11-14_211734.csv
prohibit,proibir,86,"COD: prevenir.",30746,lus_imported_from_english_with_lemma_chunk174_2025-11-14_211734.csv
starve,privar,86,"FN: deixar alguém totalmente sem um objeto ou estado desejado.",17175,lus_imported_from_english_with_lemma_chunk174_2025-11-14_211734.csv
advance,avançar,86,"FN: fazer progresso",15460,lus_imported_from_english_with_lemma_chunk174_2025-11-14_211734.csv
improve,melhorar,86,"FN: para se tornar melhor",15470,lus_imported_from_english_with_lemma_chunk174_2025-11-14_211734.csv
bar,proibir,86,"FN: proibir algo de acontecer",13611,lus_imported_from_english_with_lemma_chunk175_2025-11-14_212046.csv
sanction,permitir,86,"FN: permitir.",13615,lus_imported_from_english_with_lemma_chunk175_2025-11-14_212046.csv
censorship,censura,83,"A supressão ou proibição de uma entidade ou ato.",34862,lus_imported_from_english_with_lemma_chunk175_2025-11-14_212046.csv
go,ir,86,"COD: passar para ou estar em um estado especificado, especialmente um indesejado:",18483,lus_imported_from_english_with_lemma_chunk175_2025-11-14_212046.csv
get,ficar,86,"FN: entrar em um estado especificado",14763,lus_imported_from_english_with_lemma_chunk175_2025-11-14_212046.csv
metamorphosis,metamorfose,83,"COD: uma mudança de forma ou natureza.",18484,lus_imported_from_english_with_lemma_chunk175_2025-11-14_212046.csv
transformation,transformação,83,"FN: mudar de forma para um novo tipo.",18486,lus_imported_from_english_with_lemma_chunk175_2025-11-14_212046.csv
metamorphose,metamorfosear,86,"FN: mudar de forma, muitas vezes terminando em um estado mais avançado e/ou preferível.",18487,lus_imported_from_english_with_lemma_chunk175_2025-11-14_212046.csv
transmute,Transmutar,86,"FN: mudança de uma maneira surpreendente.",18489,lus_imported_from_english_with_lemma_chunk175_2025-11-14_212046.csv
transition,transicionar,86,"FN: mudança (de uma categoria ou estado para outro); uso especializado para mudar o status de gênero.",18495,lus_imported_from_english_with_lemma_chunk175_2025-11-14_212046.csv
bench,banco,83,"Uma longa cadeira para várias pessoas, normalmente feita de madeira ou pedra.",31133,lus_imported_from_english_with_lemma_chunk175_2025-11-14_212046.csv
side,acompanhamento,83,"Alimentos que acompanham o prato principal.",25524,lus_imported_from_english_with_lemma_chunk175_2025-11-14_212046.csv
garnish,Acompanhamento,83,"Acompanhamento para o prato principal.",25525,lus_imported_from_english_with_lemma_chunk175_2025-11-14_212046.csv
starter,entrada,83,"Alimentos que servem como aperitivo para despertar o apetite.",25532,lus_imported_from_english_with_lemma_chunk175_2025-11-14_212046.csv
departure,partida,83,"o ato de sair de um lugar",25953,lus_imported_from_english_with_lemma_chunk175_2025-11-14_212046.csv
creative,Criativo,84,"Alguém que pode criar, que tem criatividade.",33767,lus_imported_from_english_with_lemma_chunk175_2025-11-14_212046.csv
generous,generoso,84,"Uma pessoa ou entidade que está disposta a dar mais do que o esperado de algo.",34159,lus_imported_from_english_with_lemma_chunk175_2025-11-14_212046.csv
side,faceta,83,"Uma das características de personalidade de uma entidade.",34242,lus_imported_from_english_with_lemma_chunk175_2025-11-14_212046.csv
ambitious,Ambicioso,84,"Ter um forte desejo de sucesso,",34278,lus_imported_from_english_with_lemma_chunk175_2025-11-14_212046.csv
complacent,complacente,84,"O ato ou situação de se sentir satisfeito consigo mesmo.",34346,lus_imported_from_english_with_lemma_chunk175_2025-11-14_212046.csv
revolt,revoltar,86,"COD: ascensão da rebelião contra a autoridade",29717,lus_imported_from_english_with_lemma_chunk175_2025-11-14_212046.csv
rebel,rebelar-se,86,"FN: recusa-se a aceitar regras anteriores ou estabelecidas.",29719,lus_imported_from_english_with_lemma_chunk175_2025-11-14_212046.csv
worry,preocupar,86,"COD: sentir ou causar para sentir-se incomodado sobre dificuldades reais ou potenciais.",30664,lus_imported_from_english_with_lemma_chunk176_2025-11-14_212244.csv
tumor,tumor,83,,39871,lus_imported_from_english_with_lemma_chunk176_2025-11-14_212244.csv
dose,dose,83,,39247,lus_imported_from_english_with_lemma_chunk176_2025-11-14_212244.csv
two_hundred,duzentos,85,,40076,lus_imported_from_english_with_lemma_chunk176_2025-11-14_212244.csv
first,primeiro,85,"usado para se referir ou introduzir um primeiro ponto, tópico, etc.",43831,lus_imported_from_english_with_lemma_chunk176_2025-11-14_212244.csv
third,terceiro,85,"usado para se referir ou introduzir um ponto, tópico, etc. que vem depois do segundo",43833,lus_imported_from_english_with_lemma_chunk176_2025-11-14_212244.csv
fifth,quinto,85,"usado para se referir ou introduzir um ponto, tópico, etc. que vem depois do quarto",43836,lus_imported_from_english_with_lemma_chunk176_2025-11-14_212244.csv
second,segundo,85,"usado para se referir ou introduzir um ponto, tópico, etc. que vem depois do primeiro",43837,lus_imported_from_english_with_lemma_chunk176_2025-11-14_212244.csv
mr,meritíssimo,83,"Vossa Merítissima",43805,lus_imported_from_english_with_lemma_chunk176_2025-11-14_212244.csv
madam,Senhora,83,"endereço termo para uma mulher, usado isoladamente ou precedendo o nome ou cargo de uma mulher",43806,lus_imported_from_english_with_lemma_chunk176_2025-11-14_212244.csv
unfortunately,infelizmente,89,"na visão do orador, algo é muito menos que ideal; negativo ou triste",43854,lus_imported_from_english_with_lemma_chunk176_2025-11-14_212244.csv
support,apoiar,86,"ser a favor de algo",43857,lus_imported_from_english_with_lemma_chunk176_2025-11-14_212244.csv
view,opinião,83,"a forma como uma pessoa pensa sobre algo, sua posição sobre um problema",43866,lus_imported_from_english_with_lemma_chunk176_2025-11-14_212244.csv
frankly,francamente,89,"usado para marcar que alguém está dando uma opinião honesta e direta",43849,lus_imported_from_english_with_lemma_chunk176_2025-11-14_212244.csv
honest,honesto,84,"Sincero e sem engano; verdadeiro, sincero",43851,lus_imported_from_english_with_lemma_chunk176_2025-11-14_212244.csv
but,mas,91,"adicionar uma declaração com um conteúdo diferente do que foi dito antes",43824,lus_imported_from_english_with_lemma_chunk176_2025-11-14_212244.csv
but,mas,94,"adicionar uma declaração com um conteúdo que é diferente do que foi dito antes",43824,lus_imported_from_english_with_lemma_chunk176_2025-11-14_212244.csv
contrast,contraste,83,"precedido por a preposição 'em' ou 'por' e usado como um conector, acrescenta uma declaração com um conteúdo que é diferente do que foi dito antes",43826,lus_imported_from_english_with_lemma_chunk176_2025-11-14_212244.csv
probably,provavelmente,89,"o orador acredita que é provável que algo seja o caso; quase certamente",43843,lus_imported_from_english_with_lemma_chunk176_2025-11-14_212244.csv
undoubtedly,indubitavelmente,89,"o orador tem certeza absoluta de que algo é verdade, sem dúvida",43845,lus_imported_from_english_with_lemma_chunk176_2025-11-14_212244.csv
perhaps,talvez,89,"Um orador acredita que algo pode ser o caso; não certo",43847,lus_imported_from_english_with_lemma_chunk176_2025-11-14_212244.csv
certainly,"com certeza",89,"o orador tem certeza de que algo é o caso; sem dúvida",43848,lus_imported_from_english_with_lemma_chunk176_2025-11-14_212244.csv
know,saber,86,"ter alguma informação/peça de conteúdo na mente, estar ciente/ familiar com algo",43821,lus_imported_from_english_with_lemma_chunk176_2025-11-14_212244.csv
skin,esfolar,86,"COD: retira a pele de",5516,lus_imported_from_english_with_lemma_chunk17_2025-11-14_124656.csv
core,descaroçar,86,"COD: remover o miolo de (uma fruta)",5517,lus_imported_from_english_with_lemma_chunk17_2025-11-14_124656.csv
peel,descascar,86,"COD: retira a cobertura externa ou pele de (uma fruta, vegetal, etc.)",5518,lus_imported_from_english_with_lemma_chunk17_2025-11-14_124656.csv
gut,eviscerar,86,"COD: remover ou destruir as partes internas de",5519,lus_imported_from_english_with_lemma_chunk17_2025-11-14_124656.csv
bone,desossar,86,"COD: retire os ossos de (carne ou peixe) antes de cozinhar",5520,lus_imported_from_english_with_lemma_chunk17_2025-11-14_124656.csv
unload,descarregar,86,"COD: remove a carga de.",5530,lus_imported_from_english_with_lemma_chunk17_2025-11-14_124656.csv
evacuate,evacuar,86,"FN: esvaziar um recipiente (especialmente um edifício de pessoas, para garantir segurança)",5534,lus_imported_from_english_with_lemma_chunk17_2025-11-14_124656.csv
stone,descaroçar,86,"FN: remover a pedra de algo, tipicamente uma fruta de pedra",5544,lus_imported_from_english_with_lemma_chunk17_2025-11-14_124656.csv
stalk,desgalhar,86,"FN: remover o caule de algo, tipicamente um vegetal",5545,lus_imported_from_english_with_lemma_chunk17_2025-11-14_124656.csv
flush,lavar,86,"FN: livre de sujeira, detritos, etc., por passar com um fluido.",5546,lus_imported_from_english_with_lemma_chunk17_2025-11-14_124656.csv
weed,capinar,86,"FN: remover ervas daninhas (ou, metaforicamente, elementos indesejados) de.",5548,lus_imported_from_english_with_lemma_chunk17_2025-11-14_124656.csv
adorn,adornar,86,"FN: cobertura com decoração",5549,lus_imported_from_english_with_lemma_chunk17_2025-11-14_124656.csv
cover,cobrir,86,"COD: colocar algo em cima de ou na frente de (algo) para protegê-lo ou escondê-lo",5551,lus_imported_from_english_with_lemma_chunk17_2025-11-14_124656.csv
dust,polvilhar,86,"COD: cubra levemente com uma substância em pó.",5552,lus_imported_from_english_with_lemma_chunk17_2025-11-14_124656.csv
load,carregar,86,"FN: preencher uma entidade semelhante a um recipiente com algo, muitas vezes em abundância",5553,lus_imported_from_english_with_lemma_chunk17_2025-11-14_124656.csv
pack,empacotar,86,"COD: preencher; empilhar um grande número de coisas em",5554,lus_imported_from_english_with_lemma_chunk17_2025-11-14_124656.csv
smear,Espalhar,86,"COD: revestir ou marcar com uma substância gordurosa ou pegajosa.",5555,lus_imported_from_english_with_lemma_chunk17_2025-11-14_124656.csv
spread,espalhar,86,"FN: cobrir (uma superfície) com uma substância aplicando-a em uma camada uniforme",5556,lus_imported_from_english_with_lemma_chunk17_2025-11-14_124656.csv
stuff,encher,86,"COD: encha firmemente com algo",5557,lus_imported_from_english_with_lemma_chunk17_2025-11-14_124656.csv
inject,injetar,86,"COD: introduzir (um novo ou diferente elemento) em algo",5563,lus_imported_from_english_with_lemma_chunk17_2025-11-14_124656.csv
cram,encher,86,"COD: preencher até o ponto de transbordamento",5564,lus_imported_from_english_with_lemma_chunk17_2025-11-14_124656.csv
seed,semear,86,"COD: semeie (terra) com sementes",5566,lus_imported_from_english_with_lemma_chunk17_2025-11-14_124656.csv
hang,pendurar,86,"FN: cobrir ou enfeitar (um lugar ou superfície) com objetos pendurados",5568,lus_imported_from_english_with_lemma_chunk17_2025-11-14_124656.csv
splatter,salpicar,86,"COD: salpicar com um líquido viscoso ou pegajoso",5572,lus_imported_from_english_with_lemma_chunk17_2025-11-14_124656.csv
spray,borrifar,86,"COD: capa ou tratar com um spray",5573,lus_imported_from_english_with_lemma_chunk17_2025-11-14_124656.csv
shower,pulverizar,86,"FN: pulverizar com gotas de líquido ou partículas",5576,lus_imported_from_english_with_lemma_chunk17_2025-11-14_124656.csv
heap,amontoar,86,"COD: carregar com abundância de",5578,lus_imported_from_english_with_lemma_chunk17_2025-11-14_124656.csv
pile,empilhar,86,"FN: empilhar ou carregar com",5579,lus_imported_from_english_with_lemma_chunk17_2025-11-14_124656.csv
plant,plantar,86,"FN: preencher uma área com (sementes ou plantas)",5582,lus_imported_from_english_with_lemma_chunk17_2025-11-14_124656.csv
butter,untar,86,"COD: espalhe manteiga",5584,lus_imported_from_english_with_lemma_chunk17_2025-11-14_124656.csv
asphalt,asfaltar,86,"COD: superfície com asfalto",5585,lus_imported_from_english_with_lemma_chunk17_2025-11-14_124656.csv
surface,pavimentar,86,"COD: fornecer (algo, especialmente uma estrada) com uma superfície específica",5586,lus_imported_from_english_with_lemma_chunk17_2025-11-14_124656.csv
tile,telhar,86,"COD: cobrir com telhas",5587,lus_imported_from_english_with_lemma_chunk17_2025-11-14_124656.csv
coat,revestir,86,"COD: fornecer com ou formar uma camada ou cobertura",5589,lus_imported_from_english_with_lemma_chunk17_2025-11-14_124656.csv
fill,preencher,86,"FN: fazer completo",5591,lus_imported_from_english_with_lemma_chunk17_2025-11-14_124656.csv
strew,Espalhar,86,"COD: cobrir (uma superfície ou área) com coisas espalhadas de forma desarrumada",5592,lus_imported_from_english_with_lemma_chunk17_2025-11-14_124656.csv
flood,inundar,86,"COD: preencher ou perfumar completamente",5594,lus_imported_from_english_with_lemma_chunk17_2025-11-14_124656.csv
crowd,encher,86,"FN: preencher (quase completamente) um espaço",5595,lus_imported_from_english_with_lemma_chunk17_2025-11-14_124656.csv
pave,pavimentar,86,"COD: cobrir (uma peça de terreno) com pedras ou tijolos planos",5596,lus_imported_from_english_with_lemma_chunk17_2025-11-14_124656.csv
wash,cobrir,86,"FN: cobrir com uma camada fina (esp cor ou metal).",5604,lus_imported_from_english_with_lemma_chunk17_2025-11-14_124656.csv
plank,tabelar,86,"FN: cobrir com tábuas.",5605,lus_imported_from_english_with_lemma_chunk17_2025-11-14_124656.csv
yoke,jungir,86,"FN: encaixe com uma viga de tração.",5606,lus_imported_from_english_with_lemma_chunk17_2025-11-14_124656.csv
dress,decorar,86,"COD: decore de forma artística ou atraente",5607,lus_imported_from_english_with_lemma_chunk17_2025-11-14_124656.csv
buzz,zumbir,86,"FN: mover-se fazendo um zumbido baixo semelhante ao de uma abelha.",5610,lus_imported_from_english_with_lemma_chunk18_2025-11-14_124951.csv
patter,tamborilar,86,"FN: corre fazendo um som de batidinha leve.",5627,lus_imported_from_english_with_lemma_chunk18_2025-11-14_124951.csv
swish,sussurrar,86,"COD: move com um som de assobio ou correção.",5638,lus_imported_from_english_with_lemma_chunk18_2025-11-14_124951.csv
zing,disparar,86,"COD: move rapidamente.",5645,lus_imported_from_english_with_lemma_chunk18_2025-11-14_124951.csv
angle,inclinar,86,"FN: mover-se em um ângulo (inclinação linear em comparação com algum ponto)",5647,lus_imported_from_english_with_lemma_chunk18_2025-11-14_124951.csv
bear,virar,86,"FN: virar (como um caminho) em uma direção especificada",5648,lus_imported_from_english_with_lemma_chunk18_2025-11-14_124951.csv
cross,atravessar,86,"COD: mover para o outro lado de; mover em uma direção oposta ou diferente",5650,lus_imported_from_english_with_lemma_chunk18_2025-11-14_124951.csv
drop,cair,86,"COD: cair verticalmente",5653,lus_imported_from_english_with_lemma_chunk18_2025-11-14_124951.csv
edge,contornar,86,"FN: para prosseguir ao longo do perímetro de algo, como um caminho",5654,lus_imported_from_english_with_lemma_chunk18_2025-11-14_124951.csv
exit,sair,86,"COD: sair ou deixar um lugar",5656,lus_imported_from_english_with_lemma_chunk18_2025-11-14_124951.csv
rise,subir,86,"FN: a encosta para cima",5661,lus_imported_from_english_with_lemma_chunk18_2025-11-14_124951.csv
skirt,contornar,86,"FN: levar ao redor de algo",5662,lus_imported_from_english_with_lemma_chunk18_2025-11-14_124951.csv
snake,serpentear,86,"FN: torcer (um caminho)",5664,lus_imported_from_english_with_lemma_chunk18_2025-11-14_124951.csv
swerve,desviar,86,"COD: abruptamente diverge ou de um curso reto",5665,lus_imported_from_english_with_lemma_chunk18_2025-11-14_124951.csv
swing,serpentear,86,"FN: prosseguir (como um caminho) mudando de direção subitamente",5666,lus_imported_from_english_with_lemma_chunk18_2025-11-14_124951.csv
wind,serpentear,86,"FN: para liderar (como um caminho) em um curso tortuoso",5671,lus_imported_from_english_with_lemma_chunk18_2025-11-14_124951.csv
emergence,surgimento,83,"FN: o ato ou instância de sair (de um lugar escuro) gradualmente",5685,lus_imported_from_english_with_lemma_chunk18_2025-11-14_124951.csv
crest,culminar,86,"FN: acabar no topo de uma área como uma montanha ou colina",5686,lus_imported_from_english_with_lemma_chunk18_2025-11-14_124951.csv
twist,torcer,86,"COD: tomar ou ter um curso sinuoso",5691,lus_imported_from_english_with_lemma_chunk18_2025-11-14_124951.csv
deposit,depositar,86,"COD: colocar ou colocar em um lugar específico.",5693,lus_imported_from_english_with_lemma_chunk18_2025-11-14_124951.csv
implant,implantar,86,"COD: inserir ou fixar (tecido ou um objeto artificial) no corpo",5698,lus_imported_from_english_with_lemma_chunk18_2025-11-14_124951.csv
inject,injetar,86,"COD: introduzir (uma substância líquida, especialmente uma droga ou vacina) no corpo com uma seringa",5699,lus_imported_from_english_with_lemma_chunk18_2025-11-14_124951.csv
lay,colocar,86,"COD: lugar ou fixar (equipamento) na posição pronta para uso.",5702,lus_imported_from_english_with_lemma_chunk18_2025-11-14_124951.csv
lean,inclinar,86,"COD: inclinar-se do perpendicular e descansar contra.",5703,lus_imported_from_english_with_lemma_chunk18_2025-11-14_124951.csv
load,carregar,86,"COD: colocar uma carga em ou em (veículo, navio, etc.).",5704,lus_imported_from_english_with_lemma_chunk18_2025-11-14_124951.csv
pack,embalar,86,"COD: colocar em um recipiente para transporte ou armazenamento",5706,lus_imported_from_english_with_lemma_chunk18_2025-11-14_124951.csv
park,estacionar,86,"COD: depósito ou deixar em um local conveniente até que seja necessário",5707,lus_imported_from_english_with_lemma_chunk18_2025-11-14_124951.csv
pile,empilhar,86,"COD: lugar (coisas) uma sobre a outra",5708,lus_imported_from_english_with_lemma_chunk18_2025-11-14_124951.csv
place,colocar,86,"Colocar em uma posição específica.",5709,lus_imported_from_english_with_lemma_chunk18_2025-11-14_124951.csv
plant,plantar,86,"COD: coloque (uma semente, bulbo ou planta) no chão para que ela possa crescer.",5711,lus_imported_from_english_with_lemma_chunk18_2025-11-14_124951.csv
position,posicionar,86,"COD: colocar ou organizar em uma posição específica.",5712,lus_imported_from_english_with_lemma_chunk18_2025-11-14_124951.csv
rest,repousar,86,"COD: lugar ou ser colocado de modo a ficar em uma posição especificada",5713,lus_imported_from_english_with_lemma_chunk18_2025-11-14_124951.csvG2246

set,colocar,86,"COD: colocar, deitar ou ficar (algo) em um lugar ou posição especificada",5714,lus_imported_from_english_with_lemma_chunk18_2025-11-14_124951.csv
situate,situar,86,"COD: lugar em um local ou contexto específico",5715,lus_imported_from_english_with_lemma_chunk19_2025-11-14_125245.csv
smear,Espalhar,86,"COD: espalhar (uma substância gordurosa ou pegajosa) sobre uma superfície",5716,lus_imported_from_english_with_lemma_chunk19_2025-11-14_125245.csv
stash,armazenar,86,"COD: armazenar com segurança em um local secreto.",5718,lus_imported_from_english_with_lemma_chunk19_2025-11-14_125245.csv
bag,embolsar,86,"COD: colocar numa bolsa",5723,lus_imported_from_english_with_lemma_chunk19_2025-11-14_125245.csv
bottle,engarrafar,86,"COD: lugar em garrafas para armazenamento",5726,lus_imported_from_english_with_lemma_chunk19_2025-11-14_125245.csv
box,encaixotar,86,"COD: colar em ... uma caixa",5728,lus_imported_from_english_with_lemma_chunk19_2025-11-14_125245.csv
crate,encaixotar,86,"COD: embalar em uma caixa para transporte",5730,lus_imported_from_english_with_lemma_chunk19_2025-11-14_125245.csv
pocket,embolsar,86,"COD: colocar no bolso",5733,lus_imported_from_english_with_lemma_chunk19_2025-11-14_125245.csv
dust,polvilhar,86,"FN: aplicar (uma substância em pó) levemente sobre uma superfície",5743,lus_imported_from_english_with_lemma_chunk19_2025-11-14_125245.csv
heap,empilhar,86,"COD: colocar ou formar uma pilha",5744,lus_imported_from_english_with_lemma_chunk19_2025-11-14_125245.csv
rub,esfregar,86,"COD: aplicar com uma ação de esfregar",5746,lus_imported_from_english_with_lemma_chunk19_2025-11-14_125245.csv
cram,abarrotar,86,"COD: forçar muitas coisas (pessoas ou objetos) em um recipiente",5747,lus_imported_from_english_with_lemma_chunk19_2025-11-14_125245.csv
shower,duchar,86,"FN: derrame ou despeje (um líquido ou outra substância) em uma ducha",5748,lus_imported_from_english_with_lemma_chunk19_2025-11-14_125245.csv
pot,plantar,86,"COD: planta em um vaso",5749,lus_imported_from_english_with_lemma_chunk19_2025-11-14_125245.csv
warehouse,armazenar,86,"FN: local em um armazém.",5751,lus_imported_from_english_with_lemma_chunk19_2025-11-14_125245.csv
shoulder,suportar,86,"FN: para apoiar ou continuar ou como se estivesse sobre os ombros",5752,lus_imported_from_english_with_lemma_chunk19_2025-11-14_125245.csv
stick,enfiar,86,"COD: com objeto e advérbio de lugar, colocar em algum lugar de maneira rápida ou descuidada.",5753,lus_imported_from_english_with_lemma_chunk19_2025-11-14_125245.csv
bestow,colocar,86,"COD: [arcaico] colocar (algo) em um lugar especificado.",5754,lus_imported_from_english_with_lemma_chunk19_2025-11-14_125245.csv
package,embalar,86,"COD: colocar em uma caixa ou embrulho.",5756,lus_imported_from_english_with_lemma_chunk19_2025-11-14_125245.csv
arrange,arrumar,86,"FN: colocar em ordem sobre ou contra um fundo",5758,lus_imported_from_english_with_lemma_chunk19_2025-11-14_125245.csv
enclose,conter,86,"FN: inserir dentro de um recipiente",5760,lus_imported_from_english_with_lemma_chunk19_2025-11-14_125245.csv
drain,drenar,86,"FN: causar líquido para sair de, esvaziado de",5767,lus_imported_from_english_with_lemma_chunk19_2025-11-14_125245.csv
evacuate,evacuar,86,"COD: remover de um lugar perigoso para um lugar mais seguro",5773,lus_imported_from_english_with_lemma_chunk19_2025-11-14_125245.csv
evacuation,evacuação,83,"COD: evacuação é um derivado de evacuar",5774,lus_imported_from_english_with_lemma_chunk19_2025-11-14_125245.csv
evict,expulsar,86,"FN: remover um inquilino de uma residência por violação do contrato de locação, esp. não pagamento",5775,lus_imported_from_english_with_lemma_chunk19_2025-11-14_125245.csv
eviction,expulsão,83,"COD: expulsão é um derivado de expulsar",5776,lus_imported_from_english_with_lemma_chunk19_2025-11-14_125245.csv
expel,expulsar,86,"COD: forçar ou expulsar",5778,lus_imported_from_english_with_lemma_chunk19_2025-11-14_125245.csv
expulsion,expulsão,83,"COD: a ação de expulsar.",5779,lus_imported_from_english_with_lemma_chunk19_2025-11-14_125245.csv
oust,derrubar,86,"COD: conduzir ou expulsar de uma posição ou lugar",5782,lus_imported_from_english_with_lemma_chunk19_2025-11-14_125245.csv
pluck,Arrancar,86,"COD: tomar e remover rapidamente de seu lugar.",5783,lus_imported_from_english_with_lemma_chunk19_2025-11-14_125245.csv
prise,arrancar,86,"COD: obter algo de (alguém) com esforço ou dificuldade.",5784,lus_imported_from_english_with_lemma_chunk19_2025-11-14_125245.csv
skim,Desnatar,86,"COD: remover (uma substância) da superfície de um líquido",5789,lus_imported_from_english_with_lemma_chunk19_2025-11-14_125245.csv
snatch,arrebatar,86,"COD: capturar rapidamente e habilmente.",5790,lus_imported_from_english_with_lemma_chunk19_2025-11-14_125245.csv
take,tomar,86,"COD: remover de um lugar",5793,lus_imported_from_english_with_lemma_chunk19_2025-11-14_125245.csv
