lemmaName(en),lemmaName(pt),idPOS,senseDescription(pt),idLU,source_file
dazzle,deslumbrar,86,"COD: sobrecarregado com uma qualidade impressionante.",5132,lus_imported_from_english_with_lemma_chunk13_2025-11-14_123557.csv
delight,deleitar,86,"COD: por favor.",5133,lus_imported_from_english_with_lemma_chunk13_2025-11-14_123557.csv
depress,deprimir,86,"COD: causar para se sentir completamente desanimado ou abatido.",5134,lus_imported_from_english_with_lemma_chunk13_2025-11-14_123557.csv
discomfit,desconcertar,86,"COD: causar desconforto ou constrangimento.",5136,lus_imported_from_english_with_lemma_chunk13_2025-11-14_123557.csv
dishearten,desanimar,86,"COD: causar perda de determinação ou confiança.",5139,lus_imported_from_english_with_lemma_chunk13_2025-11-14_123557.csv
distress,angustiar,86,"COD: causar angústia em.",5141,lus_imported_from_english_with_lemma_chunk13_2025-11-14_123557.csv
entertain,entreter,86,"COD: fornecer com diversão ou prazer.",5146,lus_imported_from_english_with_lemma_chunk13_2025-11-14_123557.csv
frighten,assustar,86,"COD: causar medo.",5151,lus_imported_from_english_with_lemma_chunk13_2025-11-14_123557.csv
gall,irritar,86,"COD: irritar; humilhar.",5153,lus_imported_from_english_with_lemma_chunk13_2025-11-14_123557.csv
gladden,alegrar,86,"COD: fazer feliz.",5154,lus_imported_from_english_with_lemma_chunk13_2025-11-14_123557.csv
rattle,perturbar,86,"COD: causar nervosismo, preocupação ou irritação.",5168,lus_imported_from_english_with_lemma_chunk13_2025-11-14_123557.csv
satisfy,satisfazer,86,"COD: atender às expectativas, necessidades ou desejos de.",5172,lus_imported_from_english_with_lemma_chunk13_2025-11-14_123557.csv
scare,assustar,86,"COD: causar grande medo ou nervosismo em; assustar.",5173,lus_imported_from_english_with_lemma_chunk13_2025-11-14_123557.csv
shake,chocar,86,"COD: choque ou espanto.",5174,lus_imported_from_english_with_lemma_chunk13_2025-11-14_123557.csv
shame,envergonhar,86,"COD: causar vergonha.",5175,lus_imported_from_english_with_lemma_chunk13_2025-11-14_123557.csv
shock,chocar,86,"COD: causar surpresa e perturbação em alguém",5176,lus_imported_from_english_with_lemma_chunk13_2025-11-14_123557.csv
startle,assustar,86,"COD: causar um choque ou alarme repentino.",5179,lus_imported_from_english_with_lemma_chunk13_2025-11-14_123557.csv
stimulate,estimular,86,"COD: animar ou excitar.",5180,lus_imported_from_english_with_lemma_chunk13_2025-11-14_123557.csv
surprise,surpreender,86,"COD: causar surpresa.",5182,lus_imported_from_english_with_lemma_chunk13_2025-11-14_123557.csv
thrill,arrepiar,86,"COD: ter ou causar um arrepio.",5184,lus_imported_from_english_with_lemma_chunk13_2025-11-14_123557.csv
bore,entediar,86,"COD: causar fadiga e desinteresse por ser monótono e tedioso",5188,lus_imported_from_english_with_lemma_chunk13_2025-11-14_123557.csv
vexation,vexação,83,"FN: o ato de assediar ou atormentar ou o estado de ser atormentado",5191,lus_imported_from_english_with_lemma_chunk13_2025-11-14_123557.csv
shocker,chocante,83,"COD: uma pessoa ou coisa que choca, especialmente através de ser inaceitável ou sensacional.",5192,lus_imported_from_english_with_lemma_chunk13_2025-11-14_123557.csv
trouble,incomodar,86,"COD: causar angústia, dor ou inconveniência a",5196,lus_imported_from_english_with_lemma_chunk13_2025-11-14_123557.csv
solace,confortar,86,"COD: dar conforto a.",5198,lus_imported_from_english_with_lemma_chunk13_2025-11-14_123557.csv
floor,confundir,86,"COD: confundir ou abafar completamente.",5206,lus_imported_from_english_with_lemma_chunk13_2025-11-14_123557.csv
incense,irritar,86,"COD: fazer muito zangado.",5211,lus_imported_from_english_with_lemma_chunk13_2025-11-14_123557.csv
fall,cair,86,"FN: ser tomado e possivelmente destruído por um exército",17074,lus_imported_from_english_with_lemma_chunk140_2025-11-14_190711.csv
reduce,reduzir,86,"FN: Adquirir e exercer controle sobre, metaforicamente.",17076,lus_imported_from_english_with_lemma_chunk140_2025-11-14_190711.csv
overcome,superar,86,"FN: conquistar ou derrotar em um conflito",17077,lus_imported_from_english_with_lemma_chunk140_2025-11-14_190711.csv
dehydrate,desidratar,86,"FN: perder água",17086,lus_imported_from_english_with_lemma_chunk140_2025-11-14_190711.csv
attend,comparecer,86,"FN: estar presente em um determinado tempo e lugar",17089,lus_imported_from_english_with_lemma_chunk140_2025-11-14_190711.csv
attendance,frequência,83,"FN: estar presente em um evento",17091,lus_imported_from_english_with_lemma_chunk140_2025-11-14_190711.csv
leave,deixar,86,"FN: deixe permanecer em outro lugar como abandonado",17093,lus_imported_from_english_with_lemma_chunk140_2025-11-14_190711.csv
neglect,negligenciar,86,"Ser irresponsável com uma responsabilidade, não dar atenção ou cuidado suficiente para algo ou alguém.",34061,lus_imported_from_english_with_lemma_chunk140_2025-11-14_190711.csv
sponge,absorver,86,"FN: absorver",17099,lus_imported_from_english_with_lemma_chunk140_2025-11-14_190711.csv
offend,ofender,86,"FN: causar o sentimento de ofensa",17100,lus_imported_from_english_with_lemma_chunk140_2025-11-14_190711.csv
affront,afrontar,86,"FN: tratar de maneira rude",17101,lus_imported_from_english_with_lemma_chunk140_2025-11-14_190711.csv
offensive,ofensivo,84,"FN: Causando um sentimento de ofensa",17104,lus_imported_from_english_with_lemma_chunk140_2025-11-14_190711.csv
offense,ofensa,83,"FN: o sentimento ou estado causado por ser ofendido",17106,lus_imported_from_english_with_lemma_chunk140_2025-11-14_190711.csv
concern,preocupar,86,"FN: causar o sentimento de preocupação",17108,lus_imported_from_english_with_lemma_chunk140_2025-11-14_190711.csv
"call name",xingar,86,"FN: Um Agente usa epítetos para insultar um Experimentador.",17109,lus_imported_from_english_with_lemma_chunk140_2025-11-14_190711.csv
joyful,alegre,84,"FN: cheio de alegria",17110,lus_imported_from_english_with_lemma_chunk140_2025-11-14_190711.csv
glad,feliz,84,"FN: feliz e apreciativo",17112,lus_imported_from_english_with_lemma_chunk140_2025-11-14_190711.csv
unfulfilled,"não realizado",84,"FN: um sentimento de não estar realizado.",17113,lus_imported_from_english_with_lemma_chunk140_2025-11-14_190711.csv
dissatisfied,insatisfeito,84,"FN: não se sentir satisfeito",17115,lus_imported_from_english_with_lemma_chunk140_2025-11-14_190711.csv
satisfied,satisfeito,84,"FN: caracterizado por sentir satisfação",17116,lus_imported_from_english_with_lemma_chunk140_2025-11-14_190711.csv
"wrapped up",absorvido,84,"FN: distraído e ocupado com",17126,lus_imported_from_english_with_lemma_chunk140_2025-11-14_190711.csv
suspicious,suspeito,84,"FN: a ideia ou impressão de que algo ou alguém é de natureza questionável, desonesta ou perigosa.",17128,lus_imported_from_english_with_lemma_chunk140_2025-11-14_190711.csv
curiously,curiosamente,89,"FN: estranhamente",32783,lus_imported_from_english_with_lemma_chunk140_2025-11-14_190711.csv
interest,interesse,83,"FN: preocupação com o desfecho de (um estado de coisas ou evento)",32784,lus_imported_from_english_with_lemma_chunk140_2025-11-14_190711.csv
delight,alegria,83,"FN: prazer, alegria",17129,lus_imported_from_english_with_lemma_chunk140_2025-11-14_190711.csv
enjoyment,Prazer,83,"Fn: prazer",17130,lus_imported_from_english_with_lemma_chunk140_2025-11-14_190711.csv
pleasure,prazer,83,"FN: alegria, satisfação",17131,lus_imported_from_english_with_lemma_chunk140_2025-11-14_190711.csv
enjoy,desfrutar,86,"Fn: tomar prazer em",17133,lus_imported_from_english_with_lemma_chunk140_2025-11-14_190711.csv
savour,Saborear,86,"FN: experiência apreciativamente",17135,lus_imported_from_english_with_lemma_chunk140_2025-11-14_190711.csv
delight,deleitar-se,86,"FN: para desfrutar",17138,lus_imported_from_english_with_lemma_chunk140_2025-11-14_190711.csv
enthralling,Empolgante,84,"FN: capturando a atenção de",17142,lus_imported_from_english_with_lemma_chunk140_2025-11-14_190711.csv
compassion,Compaixão,83,"FN: compreensão e consciência do sofrimento de outra pessoa",17146,lus_imported_from_english_with_lemma_chunk140_2025-11-14_190711.csv
empathize,empatizar,86,"FN: compreender o lote de outra pessoa; sentir as emoções de outra como se fossem suas",17147,lus_imported_from_english_with_lemma_chunk140_2025-11-14_190711.csv
sympathize,simpatizar,86,"FN: compreender os sentimentos de outra pessoa",17148,lus_imported_from_english_with_lemma_chunk140_2025-11-14_190711.csv
feel,compadecer-se,86,"Simpatizar com o infortúnio de outra pessoa",17150,lus_imported_from_english_with_lemma_chunk140_2025-11-14_190711.csv
surprised,surpreso,84,"FN: caracterizado como se sentindo levado pelo acontecimento de algo inesperado",17154,lus_imported_from_english_with_lemma_chunk140_2025-11-14_190711.csv
shock,choque,83,"Fn: o estado de surpresa",17156,lus_imported_from_english_with_lemma_chunk140_2025-11-14_190711.csv
surprise,surpresa,83,"FN: a ocorrência de algo inesperado",17157,lus_imported_from_english_with_lemma_chunk140_2025-11-14_190711.csv
terror,Terror,83,"FN: um sentimento forte de medo ou preocupação",17167,lus_imported_from_english_with_lemma_chunk140_2025-11-14_190711.csv
face,Enfrentar,86,"FN: colocar-se na posição de entender e lidar com algo desagradável.",17170,lus_imported_from_english_with_lemma_chunk140_2025-11-14_190711.csv
confront,confrontar,86,"FN: comece a tentar lidar com um problema",17171,lus_imported_from_english_with_lemma_chunk140_2025-11-14_190711.csv
link,ligar,86,"FN: unir duas coisas como sendo relacionadas",17179,lus_imported_from_english_with_lemma_chunk141_2025-11-14_190943.csv
connect,conectar,86,"FN: relacionar uma coisa com outra",17180,lus_imported_from_english_with_lemma_chunk141_2025-11-14_190943.csv
tie,ligar,86,"FN: servir como evidência para a conexão entre duas ideias",17181,lus_imported_from_english_with_lemma_chunk141_2025-11-14_190943.csv
associate,associar,86,"FN: unir duas coisas como pelo menos vagamente relacionadas",17182,lus_imported_from_english_with_lemma_chunk141_2025-11-14_190943.csv
launch,lançar,86,"COD: começar (algo) energicamente e entusiasticamente",17209,lus_imported_from_english_with_lemma_chunk141_2025-11-14_190943.csv
pass,passar,86,"FN: transferir, passar algo para alguém.",17210,lus_imported_from_english_with_lemma_chunk141_2025-11-14_190943.csv
win,ganhar,86,"FN: receber recompensa para competição",17211,lus_imported_from_english_with_lemma_chunk141_2025-11-14_190943.csv
demolish,massacrar,86,"FN: vinho um jogo por uma margem grande",17214,lus_imported_from_english_with_lemma_chunk141_2025-11-14_190943.csv
upend,derrotar,86,"FN: derrotar",17218,lus_imported_from_english_with_lemma_chunk141_2025-11-14_190943.csv
rout,derrota,83,"COD: uma derrota decisiva.",17219,lus_imported_from_english_with_lemma_chunk141_2025-11-14_190943.csv
rout,derrotar,86,"FN: derrotar decisivamente",17220,lus_imported_from_english_with_lemma_chunk141_2025-11-14_190943.csv
rule,decidir,86,"COD: pronunciar de forma autoritária e legalmente para ser o caso",17224,lus_imported_from_english_with_lemma_chunk141_2025-11-14_190943.csv
judge,julgar,86,"FN: para governar de forma autoritária e legal é o caso",17225,lus_imported_from_english_with_lemma_chunk141_2025-11-14_190943.csv
judgment,julgamento,83,"FN: uma decisão tomada por uma autoridade jurídica",17228,lus_imported_from_english_with_lemma_chunk141_2025-11-14_190943.csv
deem,considerar,86,"FN: decidir como autoridade legal",17229,lus_imported_from_english_with_lemma_chunk141_2025-11-14_190943.csv
mention,mencionar,86,"FN: para se referir a algo sem entrar em detalhes",17230,lus_imported_from_english_with_lemma_chunk141_2025-11-14_190943.csv
touch,mencionar,86,"FN: (com ""on"") mencionar, mas não como tópico principal.",17231,lus_imported_from_english_with_lemma_chunk141_2025-11-14_190943.csv
name,nomear,86,"FN: dar uma identidade a",17232,lus_imported_from_english_with_lemma_chunk141_2025-11-14_190943.csv
indicate,indicar,86,"FN: apontar ou tornar conhecido",17233,lus_imported_from_english_with_lemma_chunk141_2025-11-14_190943.csv
identify,identificar,86,"FN: para estabelecer ser uma pessoa ou coisa específica",17234,lus_imported_from_english_with_lemma_chunk141_2025-11-14_190943.csv
finger,dedurar,86,"FN: para identificar alguém ou informar à polícia",17236,lus_imported_from_english_with_lemma_chunk141_2025-11-14_190943.csv
dissipate,dissipar,86,"FN: completamente deixar de existir",17239,lus_imported_from_english_with_lemma_chunk141_2025-11-14_190943.csv
disappearance,desaparecimento,83,"FN: um evento em que (algo) deixa de existir",17241,lus_imported_from_english_with_lemma_chunk141_2025-11-14_190943.csv
dissolve,dissolver,86,"FN: (gradualmente) cessar de existir",17244,lus_imported_from_english_with_lemma_chunk141_2025-11-14_190943.csv
toast,acabado,83,"FN: (efetivamente) fora de existência; não mais relevante",17245,lus_imported_from_english_with_lemma_chunk141_2025-11-14_190943.csv
history,partida,83,"COD: partida iminente, demissão ou morte.",17247,lus_imported_from_english_with_lemma_chunk141_2025-11-14_190943.csv
gone,acabado,84,"FN: não mais existente; esgotado",17249,lus_imported_from_english_with_lemma_chunk141_2025-11-14_190943.csv
stand,suportar,86,"FN: suportar, endurecer",17262,lus_imported_from_english_with_lemma_chunk141_2025-11-14_190943.csv
tolerant,tolerante,84,"FN: capaz de aceitar ou tolerar",17264,lus_imported_from_english_with_lemma_chunk141_2025-11-14_190943.csv
bear,suportar,86,"FN: suportar (por exemplo, dificuldades, dor)",17265,lus_imported_from_english_with_lemma_chunk141_2025-11-14_190943.csv
toleration,tolerância,83,"FN: a capacidade ou tendência de aceitar ou suportar (algo que possa ser um problema ou dificuldade)",17266,lus_imported_from_english_with_lemma_chunk141_2025-11-14_190943.csv
try,tentar,86,"FN: fazer um esforço usando algum meio",17268,lus_imported_from_english_with_lemma_chunk141_2025-11-14_190943.csv
succession,sucessão,83,"FN: sequência",17273,lus_imported_from_english_with_lemma_chunk141_2025-11-14_190943.csv
order,ordem,83,"COD: a disposição ou organização de pessoas ou coisas de acordo com uma sequência ou método específico.",17277,lus_imported_from_english_with_lemma_chunk141_2025-11-14_190943.csv
wind,enrolar,86,"FN: colocar um objeto longo e fino em uma configuração aproximadamente circular, muitas vezes envolvendo outro objeto.",17279,lus_imported_from_english_with_lemma_chunk141_2025-11-14_190943.csv
coil,enrolar,86,"FN: fazer em forma de bobina.",17283,lus_imported_from_english_with_lemma_chunk141_2025-11-14_190943.csv
twist,torcer,86,"FN: virar ou dobrar.",17284,lus_imported_from_english_with_lemma_chunk141_2025-11-14_190943.csv
curl,enrolar,86,"FN: dar forma em um caracol.",17285,lus_imported_from_english_with_lemma_chunk141_2025-11-14_190943.csv
mold,moldar,86,"FN: Fazer mudar de forma.",17286,lus_imported_from_english_with_lemma_chunk141_2025-11-14_190943.csv
roll,rolar,86,"FN: Rolar um Tema contra uma superfície para criar uma nova forma ou configuração.",17287,lus_imported_from_english_with_lemma_chunk141_2025-11-14_190943.csv
coil,enrolar,86,"FN: entrar em uma configuração enrolada.",17288,lus_imported_from_english_with_lemma_chunk141_2025-11-14_190943.csv
twist,torcer,86,"FN: tornar-se retorcido.",17290,lus_imported_from_english_with_lemma_chunk141_2025-11-14_190943.csv
seat,acomodar,86,"FN: tem capacidade para acomodar um número de pessoas sentadas.",17293,lus_imported_from_english_with_lemma_chunk141_2025-11-14_190943.csv
take,conter,86,"FN: ser capaz de conter.",17295,lus_imported_from_english_with_lemma_chunk141_2025-11-14_190943.csv
sleep,dormir,86,"FN: tem capacidade para vários indivíduos dormir.",17296,lus_imported_from_english_with_lemma_chunk141_2025-11-14_190943.csv
feed,alimentar,86,"FN: capaz de hospedar convidados para uma refeição.",17297,lus_imported_from_english_with_lemma_chunk141_2025-11-14_190943.csv
serve,servir,86,"FN: tem capacidade para servir um número de pessoas (frequentemente dito de refeições ou pratos).",17298,lus_imported_from_english_with_lemma_chunk141_2025-11-14_190943.csv
time,tempo,83,"FN: uma instância particular da ocorrência de um evento.",17299,lus_imported_from_english_with_lemma_chunk141_2025-11-14_190943.csv
repeatedly,repetidamente,89,"FN: tendo um padrão recorrente de instanciamento",17304,lus_imported_from_english_with_lemma_chunk141_2025-11-14_190943.csv
date,data,83,"FN: uma combinação específica de um dia, mês e ano, possivelmente relacionada a um evento acontecendo naquela época",17307,lus_imported_from_english_with_lemma_chunk142_2025-11-14_191208.csv
if,se,93,"FN: assumindo que há uma possibilidade de que",17325,lus_imported_from_english_with_lemma_chunk142_2025-11-14_191208.csv
"even if","mesmo que",93,"FN: embora",31031,lus_imported_from_english_with_lemma_chunk142_2025-11-14_191208.csv
"even though","mesmo que",93,"Apesar de que.",31122,lus_imported_from_english_with_lemma_chunk142_2025-11-14_191208.csv
present,apresentar,86,"FN: exibir algo para outros",17329,lus_imported_from_english_with_lemma_chunk142_2025-11-14_191208.csv
point,apontar,86,"FN: para indicar a existência ou direção de algo ou algum evento",17330,lus_imported_from_english_with_lemma_chunk142_2025-11-14_191208.csv
depict,retratar,86,"COD: representado por um desenho, pintura ou outra forma de arte",17331,lus_imported_from_english_with_lemma_chunk142_2025-11-14_191208.csv
present,apresentar,86,"FN: características sintomáticas apresentadas por um paciente",17334,lus_imported_from_english_with_lemma_chunk142_2025-11-14_191208.csv
symbolize,simbolizar,86,"COD: representar por meio de um símbolo (geralmente uma obra de arte)",17336,lus_imported_from_english_with_lemma_chunk142_2025-11-14_191208.csv
output,Saída,83,"FN: os resultados do trabalho em uma tarefa ou projeto",17341,lus_imported_from_english_with_lemma_chunk142_2025-11-14_191208.csv
land,terra,83,"FN: um local que é propriedade de alguém ou de algo (por exemplo, terras imobiliárias, terras de gestão, etc.)",17344,lus_imported_from_english_with_lemma_chunk142_2025-11-14_191208.csv
estate,propriedade,83,"COD: uma propriedade composta de uma grande casa e extensos terrenos",17347,lus_imported_from_english_with_lemma_chunk142_2025-11-14_191208.csv
prove,provar,86,"FN: ser reconhecido como tendo certas qualidades",17349,lus_imported_from_english_with_lemma_chunk142_2025-11-14_191208.csv
"turn out",resultar,86,"FN: ser reconhecido",17350,lus_imported_from_english_with_lemma_chunk142_2025-11-14_191208.csv
play,acabar,86,"FN: terminar em uma condição específica, muitas vezes após uma sequência complicada de eventos.",33155,lus_imported_from_english_with_lemma_chunk142_2025-11-14_191208.csv
win,ganhar,86,"FN: completar um jogo com um resultado favorável",17355,lus_imported_from_english_with_lemma_chunk142_2025-11-14_191208.csv
lose,perder,86,"FN: completar um jogo com um resultado desfavorável",17356,lus_imported_from_english_with_lemma_chunk142_2025-11-14_191208.csv
lose,esquivar-se,86,"FN: evadir a visão de (alguém)",17361,lus_imported_from_english_with_lemma_chunk142_2025-11-14_191208.csv
lose,perder,86,"FN: diminuir em quantidade",17363,lus_imported_from_english_with_lemma_chunk142_2025-11-14_191208.csv
spend,gastar,86,"FN: Para gastar ou consumir.",17372,lus_imported_from_english_with_lemma_chunk142_2025-11-14_191208.csv
squander,esbanjar,86,"FN: A perder tempo; gastar em vão",17373,lus_imported_from_english_with_lemma_chunk142_2025-11-14_191208.csv
"go through",gastar,86,"FN: Para gastar.",17375,lus_imported_from_english_with_lemma_chunk142_2025-11-14_191208.csv
add,adicionar,86,"FN: contribuir (algo) para uma massa",17377,lus_imported_from_english_with_lemma_chunk142_2025-11-14_191208.csv
fulfill,cumprir,86,"COD: satisfazer ou atender a uma exigência (ou condição)",17382,lus_imported_from_english_with_lemma_chunk142_2025-11-14_191208.csv
assemble,montar,86,"FN: para reunir intencionalmente",17384,lus_imported_from_english_with_lemma_chunk142_2025-11-14_191208.csv
convene,convocar,86,"FN: para montar por um propósito público",17385,lus_imported_from_english_with_lemma_chunk142_2025-11-14_191208.csv
offer,oferecer,86,"FN: dar presente (algo).",17387,lus_imported_from_english_with_lemma_chunk142_2025-11-14_191208.csv
extend,estender,86,"FN: oferta.",17389,lus_imported_from_english_with_lemma_chunk142_2025-11-14_191208.csv
wager,apostar,86,"Coloque uma aposta.",17391,lus_imported_from_english_with_lemma_chunk142_2025-11-14_191208.csv
bet,apostar,86,"FN: apostar",17393,lus_imported_from_english_with_lemma_chunk142_2025-11-14_191208.csv
add,adicionar,86,"FN: combina dois termos",17394,lus_imported_from_english_with_lemma_chunk142_2025-11-14_191208.csv
multiply,multiplicar,86,"FN: escala um número por outro número",17395,lus_imported_from_english_with_lemma_chunk142_2025-11-14_191208.csv
addition,adição,83,"FN: o processo de combinar dois números",17396,lus_imported_from_english_with_lemma_chunk142_2025-11-14_191208.csv
product,produto,83,"FN: um número que resulta de multiplicação",17401,lus_imported_from_english_with_lemma_chunk142_2025-11-14_191208.csv
divide,dividir,86,"COD: como encontrar quantas vezes (um número) contém outro",17404,lus_imported_from_english_with_lemma_chunk143_2025-11-14_191429.csv
subtraction,subtração,83,"FN: o processo de encontrar a diferença entre dois números",17405,lus_imported_from_english_with_lemma_chunk143_2025-11-14_191429.csv
difference,diferença,83,"COD: o restante após a subtração de um valor de outro",17409,lus_imported_from_english_with_lemma_chunk143_2025-11-14_191429.csv
encounter,encontrar,86,"FN: encontrar ou encontrar inesperadamente (alguém)",17414,lus_imported_from_english_with_lemma_chunk143_2025-11-14_191429.csv
stumble,deparar,86,"FN: encontrar por acaso com (alguém ou algo)",17415,lus_imported_from_english_with_lemma_chunk143_2025-11-14_191429.csv
color,raça,83,"FN: pele de uma raça específica, especialmente as que não são brancas",17418,lus_imported_from_english_with_lemma_chunk143_2025-11-14_191429.csv
asian,asiático,84,"FN: de ou relacionado à raça asiática",17420,lus_imported_from_english_with_lemma_chunk143_2025-11-14_191429.csv
image,imagem,83,"FN: algo que corresponde a uma forma idealizada",17424,lus_imported_from_english_with_lemma_chunk143_2025-11-14_191429.csv
classic,clássico,84,"Algo que é típico.",34126,lus_imported_from_english_with_lemma_chunk143_2025-11-14_191429.csv
image,imagem,83,"FN: um padrão óptico semelhante a uma entidade",17433,lus_imported_from_english_with_lemma_chunk143_2025-11-14_191429.csv
warm,quente,84,"FN: remanescente das cores de algo que dá calor",17440,lus_imported_from_english_with_lemma_chunk143_2025-11-14_191429.csv
vivid,vivo,84,"FN: forte na impressão",17441,lus_imported_from_english_with_lemma_chunk143_2025-11-14_191429.csv
dark,escuro,84,"FN: profundo em cor; não claro ou brilhante",17445,lus_imported_from_english_with_lemma_chunk143_2025-11-14_191429.csv
bright,brilhante,84,"FN: vivo em cor",17447,lus_imported_from_english_with_lemma_chunk143_2025-11-14_191429.csv
date,encontro,83,"FN: o envolvimento social organizado com outra pessoa em um momento anterior",17449,lus_imported_from_english_with_lemma_chunk143_2025-11-14_191429.csv
great,grande,84,"FN: excepcionalmente grande",17458,lus_imported_from_english_with_lemma_chunk143_2025-11-14_191429.csv
sizable,grande,84,"FN: de considerável tamanho; bastante grande",17468,lus_imported_from_english_with_lemma_chunk143_2025-11-14_191429.csv
medium,médio,84,"FN: em torno do meio entre extremos em tamanho",17485,lus_imported_from_english_with_lemma_chunk143_2025-11-14_191429.csv
dose,dose,83,,39531,lus_imported_from_english_with_lemma_chunk143_2025-11-14_191429.csv
inferior,inferior,84,,39602,lus_imported_from_english_with_lemma_chunk143_2025-11-14_191429.csv
warm,quente,84,"FN: capaz de manter o usuário em um nível confortável de calor corporal",17488,lus_imported_from_english_with_lemma_chunk143_2025-11-14_191429.csv
hot,quente,84,"FN: um nível desconfortável de calor",17493,lus_imported_from_english_with_lemma_chunk143_2025-11-14_191429.csv
warm,quente,84,"Confortável em termos de calor corporal",17494,lus_imported_from_english_with_lemma_chunk143_2025-11-14_191429.csv
cool,fresco,84,"FN: confortável em uma temperatura mais baixa",17495,lus_imported_from_english_with_lemma_chunk143_2025-11-14_191429.csv
cold,frio,84,"FN: calor corporal desconfortavelmente baixo",17496,lus_imported_from_english_with_lemma_chunk144_2025-11-14_191739.csv
"burn up",esquentar,86,"FN: ser morno de forma artificial, excessivamente quente",17498,lus_imported_from_english_with_lemma_chunk144_2025-11-14_191739.csv
window,oportunidade,83,"FN: um período de tempo que permite que uma ação ocorra",17500,lus_imported_from_english_with_lemma_chunk144_2025-11-14_191739.csv
itch,coçar,86,"FN: causar uma sensação corporal desconfortável que faz com que alguém tenha vontade de coçar",17501,lus_imported_from_english_with_lemma_chunk144_2025-11-14_191739.csv
scratch,coçar,86,"FN: aliviar uma sensação desagradável do corpo por leve abrasão da superfície da pele, muitas vezes com unhas.",17502,lus_imported_from_english_with_lemma_chunk144_2025-11-14_191739.csv
rub,esfregar,86,"FN: aplicar pressão profunda nos músculos e/ou articulações para aliviar a dor.",17504,lus_imported_from_english_with_lemma_chunk144_2025-11-14_191739.csv
massage,massagear,86,"FN: aplicar pressão em músculos e/ou articulações para aliviar dores ou dores.",17505,lus_imported_from_english_with_lemma_chunk144_2025-11-14_191739.csv
taste,provar,86,"FN: para avaliar as sensações gustativas de um alimento",17509,lus_imported_from_english_with_lemma_chunk144_2025-11-14_191739.csv
try,experimentar,86,"FN: fazer algo (para avaliar)",17510,lus_imported_from_english_with_lemma_chunk144_2025-11-14_191739.csv
