lemmaName(en),lemmaName(pt),idPOS,senseDescription(pt),idLU,source_file
apprehension,apreensão,83,"COD: a ação de prender alguém.",9381,lus_imported_from_english_with_lemma_chunk57_2025-11-14_145533.csv
book,autuar,86,"COD: faça uma nota oficial dos detalhes de (alguém que quebrou uma lei ou regra).",9382,lus_imported_from_english_with_lemma_chunk57_2025-11-14_145533.csv
track,trilha,83,"COD: um caminho raso ou uma estrada secundária.",9408,lus_imported_from_english_with_lemma_chunk57_2025-11-14_145533.csv
trail,trilha,83,"COD: um caminho batido por uma região acidentada.",9409,lus_imported_from_english_with_lemma_chunk57_2025-11-14_145533.csv
bypass,desvio,83,"COD: uma estrada que passa por uma cidade para fornecer uma rota alternativa para o tráfego de passagem.",9421,lus_imported_from_english_with_lemma_chunk57_2025-11-14_145533.csv
collect,coletar,86,"COD: chamar e receber (algo) como um direito ou devido.",9425,lus_imported_from_english_with_lemma_chunk57_2025-11-14_145533.csv
charge,cobrar,86,"COD: exigir (uma quantia) como preço de um serviço prestado ou de mercadorias fornecidas.",9426,lus_imported_from_english_with_lemma_chunk57_2025-11-14_145533.csv
collection,cobrança,83,"FN: receber dinheiro em troca de bens ou serviços prometidos ou entregues.",9427,lus_imported_from_english_with_lemma_chunk57_2025-11-14_145533.csv
fiend,viciado,83,"FN: um viciado",9432,lus_imported_from_english_with_lemma_chunk57_2025-11-14_145533.csv
alcoholic,alcoólatra,83,"COD: uma pessoa que sofre de alcoolismo.",9436,lus_imported_from_english_with_lemma_chunk57_2025-11-14_145533.csv
high,chapado,84,"COD: euforico, especialmente dos efeitos de drogas ou álcool",9440,lus_imported_from_english_with_lemma_chunk58_2025-11-14_145843.csv
trip,viagem,83,"COD: uma experiência alucinatória causada pelo uso de uma droga psicodélica.",9448,lus_imported_from_english_with_lemma_chunk58_2025-11-14_145843.csv
up,"para cima",89,"COD: em direção a um lugar ou posição mais elevada.",9455,lus_imported_from_english_with_lemma_chunk58_2025-11-14_145843.csv
down,abaixo,89,"FN: em direção a uma posição mais baixa.",9464,lus_imported_from_english_with_lemma_chunk58_2025-11-14_145843.csv
discipline,disciplinar,86,"COD: punir ou repreender formalmente por uma ofensa.",9476,lus_imported_from_english_with_lemma_chunk58_2025-11-14_145843.csv
penalty,penalidade,83,"COD: uma punição imposta por quebrar uma lei, regra ou contrato",9478,lus_imported_from_english_with_lemma_chunk58_2025-11-14_145843.csv
couple,casal,83,"COD: duas pessoas do mesmo tipo consideradas juntas",9489,lus_imported_from_english_with_lemma_chunk58_2025-11-14_145843.csv
score,vinte,83,"COD: um grupo ou conjunto de vinte",9491,lus_imported_from_english_with_lemma_chunk58_2025-11-14_145843.csv
recrimination,recriminação,83,"COD: uma acusação em resposta a uma de alguém",9558,lus_imported_from_english_with_lemma_chunk59_2025-11-14_150116.csv
critique,criticar,86,"COD: avaliar de forma detalhada e analítica",9562,lus_imported_from_english_with_lemma_chunk59_2025-11-14_150116.csv
blast,criticar,86,"COD: critique ferozmente",9569,lus_imported_from_english_with_lemma_chunk59_2025-11-14_150116.csv
censure,censurar,86,"COD: expressa severa desaprovação de; formalmente reprouver",9570,lus_imported_from_english_with_lemma_chunk59_2025-11-14_150116.csv
charge,acusar,86,"COD: acusar alguém de algo, especialmente uma infração legal.",9572,lus_imported_from_english_with_lemma_chunk59_2025-11-14_150116.csv
condemn,Condenar,86,"COD: expressa completa desaprovação de.",9575,lus_imported_from_english_with_lemma_chunk59_2025-11-14_150116.csv
condemnation,condenação,83,"FN: declaração de total desaprovação.",9576,lus_imported_from_english_with_lemma_chunk59_2025-11-14_150116.csv
criticize,criticar,86,"COD: indica as faltas de alguém de maneira desaprovadora.",9578,lus_imported_from_english_with_lemma_chunk59_2025-11-14_150116.csv
denounce,denunciar,86,"COD: publicamente declarar-se errado ou mau.",9583,lus_imported_from_english_with_lemma_chunk59_2025-11-14_150116.csv
deride,Ridicularizar,86,"COD: Expressar desprezo por; ridicularizar.",9587,lus_imported_from_english_with_lemma_chunk59_2025-11-14_150116.csv
remonstrance,protesto,83,"COD: uma protesta veemente e repreensiva.",9597,lus_imported_from_english_with_lemma_chunk59_2025-11-14_150116.csv
remonstrate,protestar,86,"COD: faça uma protesta vigorosa e repreensiva.",9598,lus_imported_from_english_with_lemma_chunk59_2025-11-14_150116.csv
scathing,cáustico,84,"COD: escarnencioso; severamente crítico.",9601,lus_imported_from_english_with_lemma_chunk59_2025-11-14_150116.csv
castigate,castigar,86,"COD: reprime severamente.",9605,lus_imported_from_english_with_lemma_chunk59_2025-11-14_150116.csv
dump,criticar,86,"FN: crítica severamente.",9608,lus_imported_from_english_with_lemma_chunk59_2025-11-14_150116.csv
rave,elogiar,86,"FN: elogiar com energia e entusiasmo",9615,lus_imported_from_english_with_lemma_chunk59_2025-11-14_150116.csv
rip,criticar,86,"FN: insultar ou criticar severamente.",9617,lus_imported_from_english_with_lemma_chunk59_2025-11-14_150116.csv
attack,atacar,86,"FN: dirigir palavras ou escritos hostis a; culpar, abusar ou criticar veementemente",9618,lus_imported_from_english_with_lemma_chunk59_2025-11-14_150116.csv
attack,ataque,83,"FN: o ato de culpar, abusar ou criticar veementemente",9619,lus_imported_from_english_with_lemma_chunk59_2025-11-14_150116.csv
protest,protestar,86,"FN: expressar objeção (a algo percebido como errado).",30982,lus_imported_from_english_with_lemma_chunk59_2025-11-14_150116.csv
nickname,apelidar,86,"COD: dar um apelido a",9622,lus_imported_from_english_with_lemma_chunk59_2025-11-14_150116.csv
name,nomear,86,"COD: dar um nome a",9625,lus_imported_from_english_with_lemma_chunk59_2025-11-14_150116.csv
baptize,batizar,86,"COD: dar um nome ou apelido especificado a.",9626,lus_imported_from_english_with_lemma_chunk59_2025-11-14_150116.csv
cane,açoitar,86,"COD: bater com um pau como punição.",9633,lus_imported_from_english_with_lemma_chunk59_2025-11-14_150116.csv
lash,Chicotada,83,"COD: um golpe ou chute forte com uma chicote ou pau.",9635,lus_imported_from_english_with_lemma_chunk59_2025-11-14_150116.csv
fine,multar,86,"COD: punir com uma multa.",9639,lus_imported_from_english_with_lemma_chunk59_2025-11-14_150116.csv
guess,Adivinhar,86,"COD: estimar ou supor (algo) sem informações suficientes para ter certeza de que está correto",4288,lus_imported_from_english_with_lemma_chunk5_2025-11-14_121450.csv
learn,aprender,86,"COD: adquirir conhecimento de ou habilidade em (algo) por meio de estudo ou experiência ou sendo ensinado",4291,lus_imported_from_english_with_lemma_chunk5_2025-11-14_121450.csv
realization,realização,83,"COD: realização é um derivado de ""realize",4292,lus_imported_from_english_with_lemma_chunk5_2025-11-14_121450.csv
surmise,suspeitar,86,"COD: supõe sem ter evidência.",4294,lus_imported_from_english_with_lemma_chunk5_2025-11-14_121450.csv
"figure out",Descobrir,86,"COD: chegar a um entendimento de alguém ou de algo",4295,lus_imported_from_english_with_lemma_chunk5_2025-11-14_121450.csv
find,encontrar,86,"FN: para verificar informações ou um fato, geralmente por raciocínio devido a uma peça de evidência",4296,lus_imported_from_english_with_lemma_chunk5_2025-11-14_121450.csv
"work out",Descobrir,86,Descobrir,4298,lus_imported_from_english_with_lemma_chunk5_2025-11-14_121450.csv
determine,determinar,86,"COD: determinar ou estabelecer por pesquisa ou cálculo.",4300,lus_imported_from_english_with_lemma_chunk5_2025-11-14_121450.csv
strike,perceber,86,"FN: chegar a uma súbita realização.",4302,lus_imported_from_english_with_lemma_chunk5_2025-11-14_121450.csv
gather,reunir,86,"FN: inferir do contexto",4304,lus_imported_from_english_with_lemma_chunk5_2025-11-14_121450.csv
differentiate,diferenciar,86,"COD: encontrar diferenças (entre)",4305,lus_imported_from_english_with_lemma_chunk5_2025-11-14_121450.csv
sort,classificar,86,"FN: selecionar de um grupo diversificado",4309,lus_imported_from_english_with_lemma_chunk5_2025-11-14_121450.csv
separate,separar,86,Distinguir,4311,lus_imported_from_english_with_lemma_chunk5_2025-11-14_121450.csv
know,saber,86,"FN: distinguir (geralmente na forma X sabe Y de Z)",4312,lus_imported_from_english_with_lemma_chunk5_2025-11-14_121450.csv
argument,argumento,83,"COD: um conjunto de razões dadas em apoio de algo.",4315,lus_imported_from_english_with_lemma_chunk5_2025-11-14_121450.csv
attest,atestar,86,"COD: fornecer ou servir como evidência clara de.",4316,lus_imported_from_english_with_lemma_chunk5_2025-11-14_121450.csv
evidence,evidenciar,86,"COD: ser ou mostrar evidência de.",4320,lus_imported_from_english_with_lemma_chunk5_2025-11-14_121450.csv
prove,provar,86,"COD: demonstrar pela evidência ou argumento a verdade ou existência de.",4322,lus_imported_from_english_with_lemma_chunk5_2025-11-14_121450.csv
show,exibir,86,"FN: servir como evidência ou servir como prova de algo",4324,lus_imported_from_english_with_lemma_chunk5_2025-11-14_121450.csv
testify,testemunhar,86,"COD: serve como evidência ou prova de algo.",4326,lus_imported_from_english_with_lemma_chunk5_2025-11-14_121450.csv
verify,verificar,86,"FN: para provar preciso ou verdadeiro por meio de uma peça de evidência",4327,lus_imported_from_english_with_lemma_chunk5_2025-11-14_121450.csv
mean,significar,86,"FN: indica um fato",4331,lus_imported_from_english_with_lemma_chunk5_2025-11-14_121450.csv
from,de,90,"FN: indicando fonte de evidência",4333,lus_imported_from_english_with_lemma_chunk5_2025-11-14_121450.csv
credence,credibilidade,83,"FN: (em construção com ""lend"") credibilidade, probabilidade de ser verdadeiro.",4341,lus_imported_from_english_with_lemma_chunk5_2025-11-14_121450.csv
support,corroborar,86,"FN: fala a verdade de alguma alegação agindo como evidência em corroboração dela.",4342,lus_imported_from_english_with_lemma_chunk5_2025-11-14_121450.csv
demonstration,Demonstração,83,"FN: Para mostrar ser verdadeiro",4345,lus_imported_from_english_with_lemma_chunk5_2025-11-14_121450.csv
reflect,refletir,86,"embodificar ou representar uma Proposição",31017,lus_imported_from_english_with_lemma_chunk5_2025-11-14_121450.csv
foresee,prever,86,"COD: esteja ciente de antemão; preveja.",4350,lus_imported_from_english_with_lemma_chunk5_2025-11-14_121450.csv
predict,prever,86,"COD: estado que (um evento especificado) acontecerá no futuro.",4351,lus_imported_from_english_with_lemma_chunk5_2025-11-14_121450.csv
unpredictable,imprevisível,84,"COD: não capaz de ser previsto; mutável",4353,lus_imported_from_english_with_lemma_chunk5_2025-11-14_121450.csv
prediction,previsão,83,"FN: uma ideia específica do que acontecerá.",4357,lus_imported_from_english_with_lemma_chunk5_2025-11-14_121450.csv
wait,Aguardar,86,"FN: esperar que um evento ou fenômeno ocorra",4360,lus_imported_from_english_with_lemma_chunk5_2025-11-14_121450.csv
conceive,conceber,86,"COD: dispositivo na mente; imaginar",4361,lus_imported_from_english_with_lemma_chunk5_2025-11-14_121450.csv
"cook up",inventar,86,"COD: inventar uma história, desculpa ou plano, especialmente um engenhoso ou astuto.",4366,lus_imported_from_english_with_lemma_chunk5_2025-11-14_121450.csv
design,projetar,86,"FN: inventar, planejar algo para um propósito específico",4367,lus_imported_from_english_with_lemma_chunk5_2025-11-14_121450.csv
devise,conceber,86,"COD: planejar ou inventar (um procedimento ou mecanismo complexo).",4368,lus_imported_from_english_with_lemma_chunk5_2025-11-14_121450.csv
formulate,formular,86,"COD: criar ou preparar de forma metódica",4369,lus_imported_from_english_with_lemma_chunk5_2025-11-14_121450.csv
invent,inventar,86,"COD: maquiagem",4372,lus_imported_from_english_with_lemma_chunk5_2025-11-14_121450.csv
invention,invenção,83,"FN: a ação de criar, inventar ou projetar algo",4373,lus_imported_from_english_with_lemma_chunk5_2025-11-14_121450.csv
design,design,83,"FN: a arte ou ação de conceber e produzir um plano ou desenho antes de algo ser construído",4377,lus_imported_from_english_with_lemma_chunk5_2025-11-14_121450.csv
invention,invenção,83,"FN: a entidade produzida pelo processo de invenção.",4378,lus_imported_from_english_with_lemma_chunk5_2025-11-14_121450.csv
find,encontrar,86,"FN: chegar a uma ideia",4379,lus_imported_from_english_with_lemma_chunk5_2025-11-14_121450.csv
creativity,criatividade,83,"FN: capacidade de vir com uma nova ideia",32418,lus_imported_from_english_with_lemma_chunk5_2025-11-14_121450.csv
applaud,aplaudir,86,"COD: mostrar aprovação batendo palmas.",4383,lus_imported_from_english_with_lemma_chunk5_2025-11-14_121450.csv
appreciate,apreciar,86,"Valorizar alguém ou algo por uma qualidade que possui",4384,lus_imported_from_english_with_lemma_chunk5_2025-11-14_121450.csv
ticket,multa,83,"FN: uma intimação ou advertência dada a um infrator de leis de trânsito",9644,lus_imported_from_english_with_lemma_chunk60_2025-11-14_150428.csv
ticket,multar,86,"COD: problema com um bilhete.",9645,lus_imported_from_english_with_lemma_chunk60_2025-11-14_150428.csv
mulct,multar,86,"FN: punir com uma multa.",9646,lus_imported_from_english_with_lemma_chunk60_2025-11-14_150428.csv
decade,década,83,"durante dez anos",9655,lus_imported_from_english_with_lemma_chunk60_2025-11-14_150428.csv
century,século,83,"FN: (de um evento ou estado) durando cem anos.",9656,lus_imported_from_english_with_lemma_chunk60_2025-11-14_150428.csv
execution,execução,83,"FN: evento no qual uma pessoa condenada é morta.",9663,lus_imported_from_english_with_lemma_chunk60_2025-11-14_150428.csv
hang,enforcar,86,"COD: matar ou ser morto por amarrar uma corda presa de cima ao pescoço e remover o suporte debaixo dos pés (usado como uma forma de pena de morte).",9668,lus_imported_from_english_with_lemma_chunk60_2025-11-14_150428.csv
"put to death",executar,86,"FN: executar alguém",9672,lus_imported_from_english_with_lemma_chunk60_2025-11-14_150428.csv
forename,"nome próprio",83,"COD: outro termo para nome próprio",9678,lus_imported_from_english_with_lemma_chunk60_2025-11-14_150428.csv
"christian name","nome de batismo",83,"FN: um nome conferido a uma pessoa no batismo ou na confirmação",9680,lus_imported_from_english_with_lemma_chunk60_2025-11-14_150428.csv
"first name","primeiro nome",83,"COD: um nome pessoal dado a alguém no nascimento ou batismo e usado antes de um sobrenome",9686,lus_imported_from_english_with_lemma_chunk60_2025-11-14_150428.csv
"given name","nome próprio",83,"COD: outro termo para nome próprio.",9691,lus_imported_from_english_with_lemma_chunk60_2025-11-14_150428.csv
go,chamar-se,86,"COD: ser conhecido ou chamado por (um nome especificado)",9714,lus_imported_from_english_with_lemma_chunk60_2025-11-14_150428.csv
daybreak,amanhecer,83,"COD: amanhecer",9723,lus_imported_from_english_with_lemma_chunk60_2025-11-14_150428.csv
march,março,83,"COD: o terceiro mês do ano. Padrões como: Calendric_unit.Abril.n",9755,lus_imported_from_english_with_lemma_chunk61_2025-11-14_150759.csv
minute,minuto,83,"COD: um período de tempo igual a sessenta segundos ou uma sexagésima de uma hora",9775,lus_imported_from_english_with_lemma_chunk61_2025-11-14_150759.csv
second,segundo,83,"COD: um sexagésimo de um minuto de tempo, que como a unidade SI de tempo é definido em termos da periodicidade natural da radiação de um átomo de césio-133",9776,lus_imported_from_english_with_lemma_chunk61_2025-11-14_150759.csv
quarter,trimestre,83,"COD: um período de três meses, usado especialmente em referência a transações financeiras",9779,lus_imported_from_english_with_lemma_chunk61_2025-11-14_150759.csv
age,era,83,"COD: um período histórico distinto.",9781,lus_imported_from_english_with_lemma_chunk61_2025-11-14_150759.csv
millennium,milênio,83,"COD: um período de mil anos, especialmente quando calculado a partir da data tradicional do nascimento de Cristo.",9787,lus_imported_from_english_with_lemma_chunk61_2025-11-14_150759.csv
holiday,feriado,83,"FN: um dia em que um festival, celebração ou evento religioso é observado",9788,lus_imported_from_english_with_lemma_chunk61_2025-11-14_150759.csv
end,terminar,86,"FN: chega ao fim.",9793,lus_imported_from_english_with_lemma_chunk61_2025-11-14_150759.csv
conclude,concluir,86,"FN: chegar ao fim.",9796,lus_imported_from_english_with_lemma_chunk61_2025-11-14_150759.csv
"draw to a close",encerrar,86,"FN: levar à etapa final, como de uma reunião ou projeto",9797,lus_imported_from_english_with_lemma_chunk61_2025-11-14_150759.csv
final,final,84,"COD: chegando ao final de uma série.",9801,lus_imported_from_english_with_lemma_chunk61_2025-11-14_150759.csv
finale,final,83,"COD: a última parte de uma peça musical, um espetáculo ou um evento público.",9802,lus_imported_from_english_with_lemma_chunk61_2025-11-14_150759.csv
pass,acabar,86,"COD: acabar",9803,lus_imported_from_english_with_lemma_chunk61_2025-11-14_150759.csv
conservation,conservação,83,"A ação ou processo de conservar algo ou fazer com que ele esteja em boas condições.",34234,lus_imported_from_english_with_lemma_chunk61_2025-11-14_150759.csv
renovate,renovar,86,"Ato e processo de fazer as coisas novas novamente.",34252,lus_imported_from_english_with_lemma_chunk61_2025-11-14_150759.csv
braise,refogar,86,"COD: fritar levemente e depois cozinhar lentamente em um recipiente fechado",9828,lus_imported_from_english_with_lemma_chunk61_2025-11-14_150759.csv
toast,torrar,86,"COD: cozinhar ou dourar por exposição a calor radiante",9839,lus_imported_from_english_with_lemma_chunk61_2025-11-14_150759.csv
saute,saltear,86,"FN: para fritar comida em uma substância gordurosa",9840,lus_imported_from_english_with_lemma_chunk61_2025-11-14_150759.csv
steam,"cozinhar no vapor",86,"COD: cozinhar por aquecimento em vapor de água fervente",9842,lus_imported_from_english_with_lemma_chunk61_2025-11-14_150759.csv
fry,fritar,86,"COD: cozinhar ou ser cozido em gordura ou óleo quente",9843,lus_imported_from_english_with_lemma_chunk62_2025-11-14_151155.csv
grill,grelhar,86,"COD: cozinhe com um grelhador",9844,lus_imported_from_english_with_lemma_chunk62_2025-11-14_151155.csv
roast,assar,86,"COD: cozinhar por exposição prolongada ao calor em um forno ou sobre uma fogueira.",9845,lus_imported_from_english_with_lemma_chunk62_2025-11-14_151155.csv
cook,cozinhar,86,"FN: preparar alimentos aplicando calor",9848,lus_imported_from_english_with_lemma_chunk62_2025-11-14_151155.csv
bake,assar,86,"COD: cozinhar por calor seco sem exposição direta a uma chama, normalmente em um forno",9849,lus_imported_from_english_with_lemma_chunk62_2025-11-14_151155.csv
barbecue,churrasquear,86,"COD: cozinhar (alimentos) em uma churrasqueira.",9850,lus_imported_from_english_with_lemma_chunk62_2025-11-14_151155.csv
"deep fry",fritar,86,"FN: cozinhar por imersão em gordura ou óleo aquecido",9851,lus_imported_from_english_with_lemma_chunk62_2025-11-14_151155.csv
scorch,chamuscar,86,"FN: queimar algo levemente na superfície ou nas bordas",9855,lus_imported_from_english_with_lemma_chunk62_2025-11-14_151155.csv
grilling,grelhar,83,"FN: o processo de cozimento por calor direto, como em uma grelha ou sobre um fogo quente",9857,lus_imported_from_english_with_lemma_chunk62_2025-11-14_151155.csv
melt,derreter,86,"FN: para amolecer pelo calor ou calor",9861,lus_imported_from_english_with_lemma_chunk62_2025-11-14_151155.csv
anorexia,anorexia,83,"COD: falta de apetite para comida, em especial também anorexia nervosa um transtorno emocional caracterizado por um desejo obsessivo de perder peso através da recusa em comer",9872,lus_imported_from_english_with_lemma_chunk62_2025-11-14_151155.csv
candida,Candida,83,"COD: um fungo parasita semelhante à levedura que às vezes causa candidíase",9879,lus_imported_from_english_with_lemma_chunk62_2025-11-14_151155.csv
cold,resfriado,83,"COD: uma infecção comum na qual a membrana mucosa do nariz e da garganta ficam inflamadas, causando corrimento nasal e espirros",9885,lus_imported_from_english_with_lemma_chunk62_2025-11-14_151155.csv
diarrhea,diarreia,83,"COD: uma condição na qual fezes são eliminadas do intestino de forma frequente e em forma líquida",9890,lus_imported_from_english_with_lemma_chunk62_2025-11-14_151155.csv
eczema,eczema,83,"COD: uma condição médica na qual manchas de pele ficam ásperas e inflamadas com bolhas que causam coceira e sangramento",9897,lus_imported_from_english_with_lemma_chunk62_2025-11-14_151155.csv
shock,choque,83,"COD: uma condição médica aguda associada a uma queda na pressão arterial, causada por perda de sangue, queimaduras graves, estresse emocional repentino, etc.",9921,lus_imported_from_english_with_lemma_chunk62_2025-11-14_151155.csv
stress,Estresse,83,"COD: um estado de tensão mental, emocional ou outra",9922,lus_imported_from_english_with_lemma_chunk62_2025-11-14_151155.csv
affliction,aflição,83,"FN: Alimento.",9936,lus_imported_from_english_with_lemma_chunk62_2025-11-14_151155.csv
condition,doença,83,"COD: uma doença ou problema médico.",9937,lus_imported_from_english_with_lemma_chunk62_2025-11-14_151155.csv
malnutrition,Desnutrição,83,"FN: a aflição de estar desnutrido",9946,lus_imported_from_english_with_lemma_chunk62_2025-11-14_151155.csv
healthy,saudável,84,"FN: em boa saúde; não doente",9949,lus_imported_from_english_with_lemma_chunk63_2025-11-14_151449.csv
develop,desenvolver,86,"FN: para contrair uma doença ou sintoma",9956,lus_imported_from_english_with_lemma_chunk63_2025-11-14_151449.csv
lug,arrastar,86,"COD: carregar ou arrastar com grande esforço",9957,lus_imported_from_english_with_lemma_chunk63_2025-11-14_151449.csv
wheel,transportar,86,"FN: transportar em ou sobre um veículo com rodas",9959,lus_imported_from_english_with_lemma_chunk63_2025-11-14_151449.csv
cart,transportar,86,"FN: transportar, às vezes em um carrinho",9960,lus_imported_from_english_with_lemma_chunk63_2025-11-14_151449.csv
fly,voar,86,"FN: transporte aéreo.",9963,lus_imported_from_english_with_lemma_chunk63_2025-11-14_151449.csv
transport,transportar,86,"COD: pegar ou transportar de um lugar para outro por meio de veículo, aeronave ou navio.",9964,lus_imported_from_english_with_lemma_chunk63_2025-11-14_151449.csv
take,levar,86,"COD: transportar ou trazer com um; transmitir ou guiar.",9965,lus_imported_from_english_with_lemma_chunk63_2025-11-14_151449.csv
drive,dirigir,86,"COD: conduzir num carro.",9966,lus_imported_from_english_with_lemma_chunk63_2025-11-14_151449.csv
truck,transportar,86,"COD: transportar por caminhão.",9968,lus_imported_from_english_with_lemma_chunk63_2025-11-14_151449.csv
row,remar,86,"FN: transporte por meio de embarcação não motorizada",9975,lus_imported_from_english_with_lemma_chunk63_2025-11-14_151449.csv
bike,pedalar,86,"FN: para transportar de bicicleta.",9977,lus_imported_from_english_with_lemma_chunk63_2025-11-14_151449.csv
bear,carregar,86,"COD: transportar.",9979,lus_imported_from_english_with_lemma_chunk63_2025-11-14_151449.csv
get,trazer,86,"FN: trazer",9981,lus_imported_from_english_with_lemma_chunk63_2025-11-14_151449.csv
play,jogar,86,"Participar de um esporte ou competição.",9992,lus_imported_from_english_with_lemma_chunk63_2025-11-14_151449.csv
face,enfrentar,86,"to play contra.",28993,lus_imported_from_english_with_lemma_chunk63_2025-11-14_151449.csv
"take on",enfrentar,86,"to play contra.",28994,lus_imported_from_english_with_lemma_chunk63_2025-11-14_151449.csv
fight,lutar,86,"Competir por algo em um esporte.",29379,lus_imported_from_english_with_lemma_chunk63_2025-11-14_151449.csv
rival,rival,83,"COD: uma pessoa ou coisa competindo com outra por superioridade ou o mesmo objetivo.",32429,lus_imported_from_english_with_lemma_chunk63_2025-11-14_151449.csv
player,jogador,83,"FN: uma pessoa que é membro ativo de uma competição",32430,lus_imported_from_english_with_lemma_chunk63_2025-11-14_151449.csv
cable,telegrafar,86,"COD: enviar um telegrama para",9997,lus_imported_from_english_with_lemma_chunk63_2025-11-14_151449.csv
wire,telegrafar,86,"COD: enviar um telegrama ou teletipo para.",9998,lus_imported_from_english_with_lemma_chunk63_2025-11-14_151449.csv
phone,telefonar,86,"FN: para comunicar ou tentar comunicar com alguém por.",9999,lus_imported_from_english_with_lemma_chunk63_2025-11-14_151449.csv
semaphore,sinalizar,86,"COD: enviar por semáforo ou por sinais semelhantes ao semáforo.",10000,lus_imported_from_english_with_lemma_chunk63_2025-11-14_151449.csv
radio,radiocomunicar,86,"COD: enviar uma mensagem por rádio",10003,lus_imported_from_english_with_lemma_chunk63_2025-11-14_151449.csv
telephone,telefonar,86,"FN: enviar uma mensagem pelo telefone",10005,lus_imported_from_english_with_lemma_chunk63_2025-11-14_151449.csv
call,chamar,86,"FN: Comunicar-se ou tentar comunicar com alguém através de telefone ou programa de computador como o Skype.",10008,lus_imported_from_english_with_lemma_chunk63_2025-11-14_151449.csv
ship,embarcar,86,"FN: causar transporte (especialmente em um navio).",10012,lus_imported_from_english_with_lemma_chunk63_2025-11-14_151449.csv
post,enviar,86,"COD: com obj. principalmente britânico enviar através do sistema postal.",10013,lus_imported_from_english_with_lemma_chunk63_2025-11-14_151449.csv
forward,despachar,86,"COD: despachar; enviar.",10015,lus_imported_from_english_with_lemma_chunk63_2025-11-14_151449.csv
route,rotear,86,"COD: v.1. roteamento ou roteamento com objeto e advérbio de direção enviar ou dirigir ao longo de um curso especificado.",10016,lus_imported_from_english_with_lemma_chunk63_2025-11-14_151449.csv
shipment,Remessa,83,"COD: uma remessa de mercadorias enviadas.",10021,lus_imported_from_english_with_lemma_chunk63_2025-11-14_151449.csv
barge,transportar,86,"FN: enviar por uma embarcação que viaja pela água",10024,lus_imported_from_english_with_lemma_chunk63_2025-11-14_151449.csv
